ignore_masked,example,example_masked,intent
,,Is the shingles vaccination covered under my plan?,benefit_coverage
,,can i get a colonoscopy,benefit_coverage
,,What are my benefits when it comes to MASKING_PROCEDURE_NAME_1?,benefit_coverage
,,My wife is 7 months pregnant. Does she qualify to get a Translucency scan?,benefit_coverage
,,I'm going to give MASKING_PROCEDURE_NAME_1,benefit_coverage
,,I'm going to give birth,benefit_coverage
,,I'm pregnant,benefit_coverage
,,I'm pregnant right now and my MASKING_PROFESSIONAL_GROUP_1 suggested I MASKING_PROCEDURE_NAME_4 a MASKING_PROCEDURE_NAME_1. Is that covered by my MASKING_PROCEDURE_NAME_2? How much is that going to cost? And where should I get this done?,benefit_coverage
,,How much would I pay out of pocket for a mammogram?,benefit_coverage
,,What is my expected out of pocket cost for procedure XYZ or surgery ABC?,benefit_coverage
,,What is my expected out of pocket cost for procedure XYZ or MASKING_PROVIDER_SPECIALTY_1 MASKING_PROCEDURE_NAME_2?,benefit_coverage
,,procedure of long bone fracture,benefit_coverage
,,How much will a MASKING_PROCEDURE_NAME_1 be if my MASKING_PROFESSIONAL_GROUP_1 is out of network?,benefit_coverage
,,How much will I pay out of pocket for an abdominal ultrasound?,benefit_coverage
,,I need knee surgery.  Is that covered?,benefit_coverage
,,I need surgery to replace a knee. Is that covered.,benefit_coverage
,,I think I need to have a MASKING_PROCEDURE_NAME_1 done this year. Can you tell me how that will affect my coverage?,benefit_coverage
,,"Are blood work tests for thyroid abnormalities covered? If not, how much does each test cost?",benefit_coverage
,,Are crutches covered by my health insurance ?,benefit_coverage
,,How much is my copay,benefit_coverage
,,How much is the average MASKING_PROCEDURE_NAME_1? Does insurance cover that?,benefit_coverage
,,How do I find out whether my plan covers knee replacement?,benefit_coverage
,,How many MASKING_PROCEDURE_NAME_1 sessions are covered?,benefit_coverage
,,How many MASKING_PROCEDURE_NAME_1 sessions are covered? What is my copay for MASKING_PROCEDURE_NAME_1?,benefit_coverage
,,Is MASKING_PROVIDER_SPECIALTY_1 a covered benefit?,benefit_coverage
,,Is my insurance covered my Cosmetic Surgery and Skin Health Center,benefit_coverage
,,Is my insurance covered my MASKING_PROVIDER_SPECIALTY_1 and MASKING_FACILITY_NAME_1,benefit_coverage
,,How do I find out whether my plan MASKING_PROCEDURE_NAME_2 MASKING_PROCEDURE_NAME_1?,benefit_coverage
,,How much will I have to pay out of pocket for an MASKING_PROCEDURE_NAME_1?,benefit_coverage
,,How much of my MASKING_PROCEDURE_NAME_1 will you cover?,benefit_coverage
,,How much will my out of pocket expenses be for my MASKING_MEDICAL_CONDITION_1 work requested by my MASKING_PROFESSIONAL_GROUP_1?,benefit_coverage
,,My wife is having Routine mammogram at RPA Lagrange Hospital. What is our coverage?,benefit_coverage
,,My kid is 9.  Are his well visits still covered by my insurance?,benefit_coverage
,,My husband needs a flu shot,benefit_coverage
,,My husband is considering Orthopedic surgery,benefit_coverage
,,My doctor mentions that I may need both hips replaced,benefit_coverage
,,My doctor informs me that I need to get a Routine mammogram and I wanted to check if my plan covers me for this?,benefit_coverage
,,My daughter is getting tubes in her ears.  How much will insurance cover vs. my expense?  Are there any hidden fees?,benefit_coverage
,,My daughter has been referred for a Speech/Language evaluation.  Is it a covered benefit?,benefit_coverage
,,My MASKING_PROFESSIONAL_GROUP_1 mentions that I may need both MASKING_PROCEDURE_NAME_1,benefit_coverage
,,How much will I pay out of pocket for an MASKING_PROCEDURE_NAME_1?,benefit_coverage
,,How much will I owe for a certain procedure?,benefit_coverage
,,How much will I have to pay to get my wisdom teeth removed?,benefit_coverage
,,"If I think I need knee surgery, what do I do next? Do I need my doctor to talk to my health plan?",benefit_coverage
,,I want to MASKING_PROCEDURE_NAME_1 my MASKING_PROFESSIONAL_GROUP_1 to see if I am healthy,benefit_coverage
,,I want to find out what level of benefits I have for MASKING_PROCEDURE_NAME_1 and MASKING_PROVIDER_SPECIALTY_1,benefit_coverage
,,can you explain what benefits are available for acupunture please?,benefit_coverage
,,want to know if MASKING_PROCEDURE_NAME_1 are part of my benefits under my present insurance.,benefit_coverage
,,"I have already had MASKING_NUMBER_a xrays this year,  how many more am I eligible for?",benefit_coverage
,,"I have already had MASKING_NUMBER_a xrays this year, how many more am I eligible for?",benefit_coverage
,,is my procedure covered by my health insurance,benefit_coverage
,,Can I get my MASKING_PROCEDURE_NAME_1 checked?,benefit_coverage
,,How much will I have to pay to get my MASKING_PROCEDURE_NAME_1?,benefit_coverage
,,How much will I have to pay out of pocket for lab work?,benefit_coverage
,,How much will I have to pay out of pocket for an MRI?,benefit_coverage
,,How much will my copay be to see a MASKING_PROVIDER_SPECIALTY_1?,benefit_coverage
,,How much will my copay be to see a dermatologist?,benefit_coverage
,,How much will my out of pocket expenses be for my lab work requested by my doctor?,benefit_coverage
,,"If I think I need MASKING_PROCEDURE_NAME_1, what do I do next? Do I need my MASKING_PROFESSIONAL_GROUP_1 to talk to my health plan?",benefit_coverage
,,how should I treat a mild sprained ankle?,benefit_coverage
,,"If I want to get MASKING_PROCEDURE_NAME_1 done because I have a family history of particular MASKING_MEDICAL_CONDITION_1, is it covered?",benefit_coverage
,,Is a MASKING_PROCEDURE_NAME_1 covered,benefit_coverage
,,internal medicine,benefit_coverage
,,MASKING_MEDICAL_CONDITION_1 and septic shock procedure cost,benefit_coverage
,,MASKING_PERSON_NAME_1 my insurance cover a MASKING_PROCEDURE_NAME_1 completely or partially?,benefit_coverage
,,MASKING_PERSON_NAME_1 there be a deductible for this procedure?,benefit_coverage
,,MASKING_PROCEDURE_NAME_1,benefit_coverage
,,How often should I get a colonoscopy?,benefit_coverage
,,What is my MASKING_PROCEDURE_NAME_1?,benefit_coverage
,,What MASKING_PROCEDURE_NAME_1 does my policy cover?,benefit_coverage
,,Want to get MRI by Dr. Rumancik,benefit_coverage
,,Want to get MASKING_PROCEDURE_NAME_1 by Dr. MASKING_PERSON_NAME_1,benefit_coverage
,,"Under my present insurance, can I get a nuchal translucency scan",benefit_coverage
,,"Under my present insurance, can I get a MASKING_PROCEDURE_NAME_1",benefit_coverage
,,How much will an eye check up cost,benefit_coverage
,,Am I covered for anything?,benefit_coverage
,,Am I elegible to have a MASKING_PROCEDURE_NAME_1?,benefit_coverage
,,Am I elegible to have a total knee replacement?,benefit_coverage
,,Am I eligible for my MASKING_PROCEDURE_NAME_1 MASKING_PROCEDURE_NAME_2?,benefit_coverage
,,Do you cover mental health benefits?,benefit_coverage
,,Do I have to pay for flu shots or are they covered?,benefit_coverage
,,MASKING_PROVIDER_SPECIALTY_1,benefit_coverage
,,My MASKING_DEPENDENT_RELATIONSHIP_1 has been MASKING_PROCEDURE_NAME_1.  Is it a covered benefit?,benefit_coverage
,,My MASKING_DEPENDENT_RELATIONSHIP_1 is MASKING_NUMBER_a.  Are his well MASKING_PROCEDURE_NAME_1 still covered by my insurance?,benefit_coverage
,,My MASKING_DEPENDENT_RELATIONSHIP_1 is considering MASKING_PROVIDER_SPECIALTY_1,benefit_coverage
,,Can I get an MASKING_PROCEDURE_NAME_1?,benefit_coverage
,,What will be my out of pocket cost for the MASKING_PROCEDURE_NAME_1?,benefit_coverage
,,Can I get an MRI?,benefit_coverage
,,Is the MASKING_PROCEDURE_NAME_1 covered under my plan?,benefit_coverage
,,Is the MASKING_PROVIDER_SPECIALTY_1 covered under my plan?,benefit_coverage
,,"Are blood work MASKING_PROCEDURE_NAME_1? If not, how much does each MASKING_PROCEDURE_NAME_5 cost?",benefit_coverage
,,Does my insurance cover knee replacement?,benefit_coverage
,,Does my insurance cover nuchal translucency MASKING_PROCEDURE_NAME_1? Also does it cover MASKING_PROCEDURE_NAME_1? How much will I have to pay for both?,benefit_coverage
,,Does my health insurance cover cosmetic treatments at the dermatologist?,benefit_coverage
,,Does my health insurance cover cavity fillings at the dentist?,benefit_coverage
,,Does my health insurance cover a dermatologist?,benefit_coverage
,,Does my MASKING_PROCEDURE_NAME_1 have to be with an RMT for it to be covered?,benefit_coverage
,,Does my MASKING_PROCEDURE_NAME_1 cover a MASKING_PROVIDER_SPECIALTY_1?,benefit_coverage
,,Does my MASKING_PROCEDURE_NAME_1 cover MASKING_PROCEDURE_NAME_6 MASKING_PROCEDURE_NAME_3 at the MASKING_PROVIDER_SPECIALTY_1?,benefit_coverage
,,What percentage will my insurance pay of this procedure?,benefit_coverage
,,Can I get a new knee under my insurance plan?,benefit_coverage
,,Can I get a new insulin pump paid for?,benefit_coverage
,,Can I get a new MASKING_PROCEDURE_NAME_1 paid for?,benefit_coverage
,,Can I get a breast pump under my insurance?,benefit_coverage
,,Can I get a MASKING_PROCEDURE_NAME_1 under my insurance?,benefit_coverage
,,Are you able to tell me about the services for pregnant women?,benefit_coverage
,,Are voluntary reproductive health procedures covered?,benefit_coverage
,,Are voluntary MASKING_PROVIDER_SPECIALTY_1 MASKING_PROCEDURE_NAME_2 covered?,benefit_coverage
,,Are there benefit limitations under my plan for physical therapy treatments?,benefit_coverage
,,What types of MASKING_PROCEDURE_NAME_1 are covered by my plan?,benefit_coverage
,,What procedures are covered under a regular check-up?,benefit_coverage
,,What is my deductible for an in-MASKING_PROCEDURE_NAME_1?,benefit_coverage
,,Will there be a deductible for this procedure?,benefit_coverage
,,I'd like to know how much I need to pay for a doctor visit,benefit_coverage
,,I would like to make an enquiry regarding a hip replacement please,benefit_coverage
,,I would like to make an enquiry regarding a MASKING_PROCEDURE_NAME_1 please,benefit_coverage
,,My MASKING_DEPENDENT_RELATIONSHIP_1 is having MASKING_PROCEDURE_NAME_1 at MASKING_FACILITY_NAME_1. What is our coverage?,benefit_coverage
,,question about how to get MASKING_PROCEDURE_NAME_1 done,benefit_coverage
,,question about how to get mri done,benefit_coverage
,,question of MASKING_PROCEDURE_NAME_1,benefit_coverage
,,question of yearly checkup,benefit_coverage
,,quick question about MASKING_PROCEDURE_NAME_1,benefit_coverage
,,quick question about mammogram,benefit_coverage
,,What MASKING_PROCEDURE_NAME_3 are covered under a MASKING_PROCEDURE_NAME_1?,benefit_coverage
,,Can I go to MASKING_FACILITY_NAME_1 for procedure ?,benefit_coverage
,,What is my co-pay for specialist visits?,benefit_coverage
,,What is my co-pay for specialist MASKING_PROCEDURE_NAME_1?,benefit_coverage
,,How much will the procedure cost me out of pocket?,benefit_coverage
,,How much will this cost?,benefit_coverage
,,How much would I pay for MASKING_PROCEDURE_NAME_1?,benefit_coverage
,,What prenatal care does my policy cover?,benefit_coverage
,,"Hello, can you please tell me if I have cover for MASKING_PROCEDURE_NAME_1?",benefit_coverage
,,How much will I have to pay out of pocket for MASKING_MEDICAL_CONDITION_1 work?,benefit_coverage
,,How much out of pocket costs will I have to pay for an x-ray?,benefit_coverage
,,How much out of pocket costs will I have to pay for an MASKING_PROCEDURE_NAME_1?,benefit_coverage
,,Are glasses covered?,benefit_coverage
,,Are eye exams included in my insurance?,benefit_coverage
,,Are dental xrays covered with my medical imaging insurance?,benefit_coverage
,,How much of my MRI scan will you cover?,benefit_coverage
,,Where can I get a new insulin pump?,benefit_coverage
,,What kind of doctor do I need to see to have my strep test covered by Insurance?,benefit_coverage
,,what will my coverage pay for the rehab my doctor recommended?,benefit_coverage
,,will my insurance cover 100% of the cost of the proceedure,benefit_coverage
,,My MASKING_DEPENDENT_RELATIONSHIP_1 is MASKING_NUMBER_a months pregnant. Does she qualify to get a MASKING_PROCEDURE_NAME_1?,benefit_coverage
,,will my insurance cover MASKING_NUMBER_a% of the cost of the proceedure,benefit_coverage
,,"Hello, can you please tell me if I have cover for Influenza?",benefit_coverage
,,How much does an H. pylori breath test cost?,benefit_coverage
,,How much does an MASKING_PROCEDURE_NAME_1 cost out-of-pocket?,benefit_coverage
,,How will my insurance cover a nuchal translucency scan?,benefit_coverage
,,I am having MASKING_PROVIDER_SPECIALTY_1 at MASKING_FACILITY_NAME_1.? Can you tell me my coverage?,benefit_coverage
,,I am having issues with MASKING_PROCEDURE_NAME_1,benefit_coverage
,,If I need to get a root canal is this covered by my insurance,benefit_coverage
,,i need an MASKING_PROCEDURE_NAME_1 of my boobs,benefit_coverage
,,i need an xray of my boobs,benefit_coverage
,,Does my insurance cover talking to a MASKING_PROFESSIONAL_GROUP_1?,benefit_coverage
,,Does my insurance cover talking to a therapist?,benefit_coverage
,,Does my insurance cover this procedure?,benefit_coverage
,,Does my insurance plan pay for a new MASKING_PROCEDURE_NAME_1?,benefit_coverage
,,Does my insurance plan pay for a new insulin pump?,benefit_coverage
,,"Hello, can you please assist and tell me if I have cover on my policy for Chiropractic care?",benefit_coverage
,,i have to MASKING_PROCEDURE_NAME_3 my MASKING_PROCEDURE_NAME_1 and want to know what my out of pocket cost will be,benefit_coverage
,,i have to schedule my colonoscopy and want to know what my out of pocket cost will be,benefit_coverage
,,how much will it cost for my MASKING_DEPENDENT_RELATIONSHIP_1 to do a MASKING_PROCEDURE_NAME_1?,benefit_coverage
,,how much will it cost for my wife to do a breast cancer exam?,benefit_coverage
,,MASKING_PERSON_NAME_1 this MASKING_PROCEDURE_NAME_1 be covered MASKING_NUMBER_a% as MASKING_PROVIDER_SPECIALTY_1?,benefit_coverage
,,how should I treat a mild MASKING_MEDICAL_CONDITION_1?,benefit_coverage
,,Does my massage have to be with an RMT for it to be covered?,benefit_coverage
,,Can I have a colonoscopy at RPA Lagrange Hospital?,benefit_coverage
,,Can I have a MASKING_PROCEDURE_NAME_1 at MASKING_FACILITY_NAME_1?,benefit_coverage
,,What is my out of pocket costs for facility and MASKING_PROFESSIONAL_GROUP_1 for a MASKING_PROCEDURE_NAME_1?,benefit_coverage
,,What is my maternity coverage?,benefit_coverage
,,"Hello, can you please MASKING_PROCEDURE_NAME_3 and tell me if I have cover on my policy for MASKING_PROVIDER_SPECIALTY_1 care?",benefit_coverage
,,Does my plan cover acupuncture?,benefit_coverage
,,How am I covered for couples therapy,benefit_coverage
,,How am I covered for MASKING_PROCEDURE_NAME_1,benefit_coverage
,,"Hi, I'm having orthopedic surgery. Can you help me figure out my coverage?",benefit_coverage
,,"Hi, I'm having MASKING_PROVIDER_SPECIALTY_1. Can you help me figure out my coverage?",benefit_coverage
,,"Hi Watson, I need to find out if my check-up is covered by my insurance",benefit_coverage
,,Are dental xrays covered with my MASKING_PROCEDURE_NAME_1 insurance?,benefit_coverage
,,severe sepsis and septic shock procedure cost,benefit_coverage
,,want to know if breast pumps are part of my benefits under my present insurance.,benefit_coverage
,,What's the cost of doing a CAT scan with my insurance policy?,benefit_coverage
,,need a mammogram,benefit_coverage
,,Where can I get a new MASKING_PROCEDURE_NAME_1?,benefit_coverage
,,Will my insurance cover a nuchal translucency scan completely or partially?,benefit_coverage
,,How much will an eye MASKING_PROCEDURE_NAME_1 cost,benefit_coverage
,,I want to have information about the MASKING_PROCEDURE_NAME_1 and whether my insurance will cover this procedure,benefit_coverage
,,I want to find out what level of benefits I have for child birth and acupuncture,benefit_coverage
,,What will my out of pocket cost be for this visit?,benefit_coverage
,,What will my out of pocket cost be for this MASKING_PROCEDURE_NAME_1?,benefit_coverage
,,is my procedure covered by my MASKING_PROCEDURE_NAME_1,benefit_coverage
,,"i need to get a flu shot, is that covered ?",benefit_coverage
,,"i need to get a MASKING_PROCEDURE_NAME_1, is that covered ?",benefit_coverage
,,I would like to know what the cost will be to get a MASKING_NUMBER_aD MASKING_PROCEDURE_NAME_3 instead of the standard MASKING_PROCEDURE_NAME_2?,benefit_coverage
,,I would like to know what the cost will be to get a 3D Mammogram instead of the standard mammogram?,benefit_coverage
,,I would like to know if breast pumps are part of my benefit,benefit_coverage
,,I would like to know if MASKING_PROCEDURE_NAME_1 are part of my benefit,benefit_coverage
,,"If I have to have a new insulin pump, will that be covered",benefit_coverage
,,My MASKING_DEPENDENT_RELATIONSHIP_1 is getting MASKING_PROCEDURE_NAME_1.  How much will insurance cover vs. my expense?  Are there any hidden fees?,benefit_coverage
,,i need me some to get some MASKING_PROCEDURE_NAME_1,benefit_coverage
,,What is my co-pay for an MASKING_PROCEDURE_NAME_1?,benefit_coverage
,,What is my co-pay for an office visit?,benefit_coverage
,,What will I pay for out of network lab charges for a Pap?,benefit_coverage
,,What will I pay for out of network MASKING_MEDICAL_CONDITION_1 charges for a MASKING_PROCEDURE_NAME_1?,benefit_coverage
,,What types of fertility treatments are covered by my plan?,benefit_coverage
,,Does my plan cover MASKING_PROVIDER_SPECIALTY_1?,benefit_coverage
,,MASKING_MEDICAL_CONDITION_1,benefit_coverage
,,"Hi MASKING_PERSON_NAME_1, I need to find out if my MASKING_PROCEDURE_NAME_1 is covered by my insurance",benefit_coverage
,,I am having orthopedic surgery at ETH Hospital.? Can you tell me my coverage?,benefit_coverage
,,Can I receive rountine medical care?,benefit_coverage
,,Are MASKING_PROCEDURE_NAME_1 covered?,benefit_coverage
,,What is my deductible for MASKING_PROCEDURE_NAME_1?,benefit_coverage
,,Are MASKING_PROVIDER_SPECIALTY_1 covered with my current insurance?,benefit_coverage
,,Are MASKING_PROCEDURE_NAME_1 included in my insurance?,benefit_coverage
,,How much does an H. pylori MASKING_PROCEDURE_NAME_1 cost?,benefit_coverage
,,What would be my co-pay in a nuchal translucency scan>,benefit_coverage
,,What would be my co-pay in a MASKING_PROCEDURE_NAME_1>,benefit_coverage
,,What is my deductible on infertilitly treatments,benefit_coverage
,,What is my deductible on infertilitly MASKING_PROCEDURE_NAME_1,benefit_coverage
,,What is my deductible for hearing aids?,benefit_coverage
,,What is my deductible for an in-office visit?,benefit_coverage
,,How much would I pay for in vitro procedures?,benefit_coverage
,,What's the cost of doing a MASKING_PROCEDURE_NAME_1 with my insurance policy?,benefit_coverage
,,Are MASKING_PROCEDURE_NAME_1 covered by my MASKING_PROCEDURE_NAME_1 ?,benefit_coverage
,,Am I eligible for my annual check up visit?,benefit_coverage
,,can i get a MASKING_PROCEDURE_NAME_1,benefit_coverage
,,Can I go to Duke Health Clinic for procedure ?,benefit_coverage
,,Are orthotics covered with my current insurance?,benefit_coverage
,,Can you me tell me about MASKING_PROVIDER_SPECIALTY_1 benefits please?,benefit_coverage
,,my doctor suggested me to go for Colonoscopy. does it under my coverage?,benefit_coverage
,,need a MASKING_PROCEDURE_NAME_1,benefit_coverage
,,How much would I pay out of pocket for a MASKING_PROCEDURE_NAME_1?,benefit_coverage
,,need to know how much my MASKING_PROCEDURE_NAME_1 exam will cost under my plan.,benefit_coverage
,,Is the chiropractor covered under my plan?,benefit_coverage
,,"Is the cost of MASKING_PROCEDURE_NAME_1 included? If yes, what's the maximum amount that is covered?",benefit_coverage
,,"Is the cost of lab tests included? If yes, what's the maximum amount that is covered?",benefit_coverage
,,Is this procedure covered under my plan?,benefit_coverage
,,Is this procedure covered?,benefit_coverage
,,Does my MASKING_PROCEDURE_NAME_1 cover MASKING_MEDICAL_CONDITION_1 fillings at the MASKING_PROFESSIONAL_GROUP_1?,benefit_coverage
,,What are my benefits when it comes to Flu Vaccines?,benefit_coverage
,,"If I have to have a new MASKING_PROCEDURE_NAME_1, will that be covered",benefit_coverage
,,"If I have an outpatient procedure, how much or what percentage would I have to out of pocket?",benefit_coverage
,,"If I have an MASKING_PROCEDURE_NAME_1, how much or what percentage would I have to out of pocket?",benefit_coverage
,,What percentage of my bill will my insurance pay for this procedure / lab work / visit?,benefit_coverage
,,What percentage of my bill will my insurance pay for this procedure / MASKING_MEDICAL_CONDITION_1 work / MASKING_PROCEDURE_NAME_1?,benefit_coverage
,,What kind of MASKING_PROFESSIONAL_GROUP_1 do I need to see to have my MASKING_MEDICAL_CONDITION_1 MASKING_PROCEDURE_NAME_1 covered by Insurance?,benefit_coverage
,,What is the estimated copay for my visit?,benefit_coverage
,,What is the estimated copay for my MASKING_PROCEDURE_NAME_1?,benefit_coverage
,,What is the copay for this session?,benefit_coverage
,,What is the average cost of procedure XYZ?,benefit_coverage
,,What is my out of pocket responsibility for an annual doctor visit?,benefit_coverage
,,Do I have coverage for shoulder surgery?,benefit_coverage
,,Is knee surgery covered for me? How much is it going to cost?,benefit_coverage
,,What is my out of pocket expense for this procedure?,benefit_coverage
,,What is my out of pocket costs for facility and physician for a total knee replacement?,benefit_coverage
,,"I need MASKING_PROCEDURE_NAME_1 for my left knee, how much will that cost me? Is it covered?",benefit_coverage
,,I need MASKING_PROCEDURE_NAME_1.  Is that covered?,benefit_coverage
,,I need MASKING_PROVIDER_SPECIALTY_1 to MASKING_PROCEDURE_NAME_1. Is that covered.,benefit_coverage
,,"I need knee surgery for my left knee, how much will that cost me? Is it covered?",benefit_coverage
,,How many PT sessions are covered?,benefit_coverage
,,My MASKING_PROFESSIONAL_GROUP_1 MASKING_PROCEDURE_NAME_3 me that I need to get a MASKING_PROCEDURE_NAME_1 and I wanted to check if my plan MASKING_PROCEDURE_NAME_3 me for this?,benefit_coverage
,,My MASKING_DEPENDENT_RELATIONSHIP_1 needs a MASKING_PROCEDURE_NAME_1,benefit_coverage
,,need to know how much my annual physical exam will cost under my plan.,benefit_coverage
,,How much will a regular checkup be if my doctor is out of network?,benefit_coverage
,,Is a MASKING_PROCEDURE_NAME_1 from a MASKING_PROVIDER_SPECIALTY_1 covered under my plan?,benefit_coverage
,,Is a checkup covered,benefit_coverage
,,my MASKING_PROFESSIONAL_GROUP_1 suggested me to go for MASKING_PROCEDURE_NAME_1. does it under my coverage?,benefit_coverage
,,Does my insurance cover MASKING_PROCEDURE_NAME_1?,benefit_coverage
,,Is a spinal adjustment from a Chiropractor covered under my plan?,benefit_coverage
,,Is acupuncture a covered benefit?,benefit_coverage
,,Is an EKG covered in my annual physical if my doctor feels it is appropriate based on our discussion during the physical?,benefit_coverage
,,Is an MASKING_PROCEDURE_NAME_6 covered in my MASKING_PROCEDURE_NAME_1 if my MASKING_PROFESSIONAL_GROUP_1 feels it is appropriate based on our MASKING_PROCEDURE_NAME_2 during the MASKING_PROCEDURE_NAME_3?,benefit_coverage
,,"Is bariatric surgery covered under the plan, and do I have use a specific facility?",benefit_coverage
,,Is colonoscopy covered under PP with HSA at no cost?,benefit_coverage
,,"If I want to get genetic testing done because I have a family history of particular diseases, is it covered?",benefit_coverage
,,Im looking to see if I can have the MASKING_PROCEDURE_NAME_1 under my eyes removed,benefit_coverage
,,Im looking to see if I can have the bags under my eyes removed,benefit_coverage
,,Is LASIK covered by my plan?,benefit_coverage
,,Is MASKING_PROCEDURE_NAME_1 covered by my plan?,benefit_coverage
,,Is MASKING_PROCEDURE_NAME_1 covered for me? How much is it going to cost?,benefit_coverage
,,Is MASKING_PROCEDURE_NAME_1 covered under PP with HSA at no cost?,benefit_coverage
,,I am having issues with male infertility,benefit_coverage
,,Also I need a new MASKING_PROCEDURE_NAME_1. How much is that? Does my insurance cover it?,benefit_coverage
,,Also I need a new insulin pump. How much is that? Does my insurance cover it?,benefit_coverage
,,Am I MASKING_PROCEDURE_NAME_1?,benefit_coverage
,,Am I covered for a strep throat test?,benefit_coverage
,,How much does an endoscopy cost out-of-pocket?,benefit_coverage
,,Can you me tell me about Acupuncture benefits please?,benefit_coverage
,,Can I have weightloss surgery?,benefit_coverage
,,Can I have weightloss MASKING_PROVIDER_SPECIALTY_1?,benefit_coverage
,,How often should I get a MASKING_PROCEDURE_NAME_1?,benefit_coverage
,,How will my insurance cover a MASKING_PROCEDURE_NAME_1?,benefit_coverage
,,What will my portion of the cost for this procedure be?,benefit_coverage
,,"I have already had 2 xrays this year, how many more am I eligible for?",benefit_coverage
,,"I have already had 2 xrays this year,  how many more am I eligible for?",benefit_coverage
,,I would like to get a second opinion on the reading of my abdominal ultrasound. Is this covered and what is the process?,benefit_coverage
,,I would like to get a second opinion on the reading of my MASKING_PROCEDURE_NAME_1. Is this covered and what is the process?,benefit_coverage
,,I want to visit my doctor to see if I am healthy,benefit_coverage
,,I want to have information about the nuchal translucency scan and whether my insurance will cover this procedure,benefit_coverage
,,what will my coverage pay for the MASKING_PROVIDER_SPECIALTY_1 my MASKING_PROFESSIONAL_GROUP_1 recommended?,benefit_coverage
,,How much can I claim back for a gp visit?,benefit_coverage
,,How much can I claim back for a gp MASKING_PROCEDURE_NAME_1?,benefit_coverage
,,How much am I covered for massages?,benefit_coverage
,,How much am I covered for MASKING_PROCEDURE_NAME_1?,benefit_coverage
