ignore_masked,example,example_masked,intent
,,how do i know how much i have spent out of pocket,deductible_oop_inquiry
,,how do i meet my yearly maximum,deductible_oop_inquiry
,,how does the in network out of pocket maximum compare to out of network,deductible_oop_inquiry
,,how much could i possibly have to pay in one year,deductible_oop_inquiry
,,how much is in network out of pocket maximum compared to out of network,deductible_oop_inquiry
,,how much is my in network yearly limit,deductible_oop_inquiry
,,how much is my individual annual limit,deductible_oop_inquiry
,,how much is my non network out of pocket max,deductible_oop_inquiry
,,how much is my out of network out of pocket max,deductible_oop_inquiry
,,how much is my out of network out of pocket maximum,deductible_oop_inquiry
,,how much is my out of pocket maximum,deductible_oop_inquiry
,,how much is the annual amount i have to pay,deductible_oop_inquiry
,,how much is the max in network out of pocket maximum,deductible_oop_inquiry
,,how much of my max have i used this year so far,deductible_oop_inquiry
,,how much of my out of pocket have i met,deductible_oop_inquiry
,,how much will i have to pay out of pocket,deductible_oop_inquiry
,,how much will i pay out of pocket,deductible_oop_inquiry
,,i am trying to figure out if the yearly limit is the same if i use providers who are not in the plan network,deductible_oop_inquiry
,,i do not get it is the out of pocket maximum by individual or MASKING_DEPENDENT_RELATIONSHIP_1,deductible_oop_inquiry
,,i have a MASKING_DEPENDENT_RELATIONSHIP_1 plan is the max out of pocket per individual or per MASKING_DEPENDENT_RELATIONSHIP_1,deductible_oop_inquiry
,,i want to know what is the most i could possibly have to pay each year for MASKING_PROCEDURE_NAME_1,deductible_oop_inquiry
,,if i go non network what is my out of pocket max,deductible_oop_inquiry
,,if i stay in network what is my annual limit,deductible_oop_inquiry
,,if my service was in network does it count towards my oop max,deductible_oop_inquiry
,,in network out of pocket maximum,deductible_oop_inquiry
,,information on out of pocket maximum coverage,deductible_oop_inquiry
,,is my coinsurance included in my out of pocket max,deductible_oop_inquiry
,,is my deductible amount the most i will have to pay in the year,deductible_oop_inquiry
,,is the out of pocket max by MASKING_DEPENDENT_RELATIONSHIP_1 or individual,deductible_oop_inquiry
,,is the out of pocket maximum by individual or do we have to keep paying until both my MASKING_DEPENDENT_RELATIONSHIP_1 and i reach the maximum,deductible_oop_inquiry
,,is there a maximum payment per year for a MASKING_DEPENDENT_RELATIONSHIP_1,deductible_oop_inquiry
,,is there a separate non network out of pocket maximum,deductible_oop_inquiry
,,is there a separate out of pocket maximum for in and out of network,deductible_oop_inquiry
,,most i can pay out of pocket a year on plan,deductible_oop_inquiry
,,most i will have to pay out of pocket,deductible_oop_inquiry
,,on my plan what is my out of network out of pocket maximum,deductible_oop_inquiry
,,out of network out of pocket maximum,deductible_oop_inquiry
,,out of pocket maximum what is it,deductible_oop_inquiry
,,please tell me what the max is we have to pay per person for per MASKING_DEPENDENT_RELATIONSHIP_1 unit,deductible_oop_inquiry
,,the most i will pay per person out of pocket,deductible_oop_inquiry
,,what bills count toward my annual max,deductible_oop_inquiry
,,what counts toward my out of pocket max,deductible_oop_inquiry
,,what counts toward my out of pocket maximum,deductible_oop_inquiry
,,what do co paymentss accumulate towards,deductible_oop_inquiry
,,what do i need to spend to reach my out of pocket max,deductible_oop_inquiry
,,what does my copay accumulate towards,deductible_oop_inquiry
,,what does the out of pocket maximum include,deductible_oop_inquiry
,,what expenses counts towards my out of pocket maximum,deductible_oop_inquiry
,,what happens if i meet my out of pocket,deductible_oop_inquiry
,,what happens if i spend over the out of pocket limit on my health plan,deductible_oop_inquiry
,,what is an out of pocket max,deductible_oop_inquiry
,,what is highest possible non network out of pocket cost,deductible_oop_inquiry
,,what is in included in maximum out of pocket expenses,deductible_oop_inquiry
,,what is maximum out of pocket expense,deductible_oop_inquiry
,,what is my annual maximum,deductible_oop_inquiry
,,what is my current oop,deductible_oop_inquiry
,,what is my in network out of pocket maximum,deductible_oop_inquiry
,,what is my in network vs out of network out of pocket maximum,deductible_oop_inquiry
,,what is my individual oop,deductible_oop_inquiry
,,what is my max out of pocket,deductible_oop_inquiry
,,what is my maximum out of pocket,deductible_oop_inquiry
,,what is my non network out of pocket max,deductible_oop_inquiry
,,what is my oop,deductible_oop_inquiry
,,what is my oop max,deductible_oop_inquiry
,,what is my out of network out of pocket max,deductible_oop_inquiry
,,what is my out of network out of pocket maximum,deductible_oop_inquiry
,,what is my out of pocket,deductible_oop_inquiry
,,what is my out of pocket cost with my kaiser plan,deductible_oop_inquiry
,,what is my out of pocket max,deductible_oop_inquiry
,,what is my out of pocket maximum,deductible_oop_inquiry
,,what is my total out of pocket,deductible_oop_inquiry
,,what is my yearly max,deductible_oop_inquiry
,,what is my yearly out of pocket limit,deductible_oop_inquiry
,,what is the annual maximum,deductible_oop_inquiry
,,what is the difference in out of pocket maximums for in network and out of network,deductible_oop_inquiry
,,what is the highest amount i will have to pay per year,deductible_oop_inquiry
,,what is the max i will pay in a year,deductible_oop_inquiry
,,what is the maximum in network out of pocket cost,deductible_oop_inquiry
,,what is the maximum out of network out of pocket cost,deductible_oop_inquiry
,,what is the most i have to pay each year,deductible_oop_inquiry
,,what is the most i have to pay each year for healthcare,deductible_oop_inquiry
,,what is the most i have to pay in a year,deductible_oop_inquiry
,,what is the most i might pay for care in a year on my plan,deductible_oop_inquiry
,,what is the most i will have to pay this year,deductible_oop_inquiry
,,what is the out of pocket limit on my health plan,deductible_oop_inquiry
,,what is the out of pocket max,deductible_oop_inquiry
,,what is the out of pocket maximum for a MASKING_DEPENDENT_RELATIONSHIP_1,deductible_oop_inquiry
,,what would my highest out of pocket be,deductible_oop_inquiry
,,what would the highest amount i have to pay for in the year be,deductible_oop_inquiry
,,will my coinsurance count towards something,deductible_oop_inquiry
,,will my copay count towards my out of pocket max,deductible_oop_inquiry
,,will my copays accumulate toward something,deductible_oop_inquiry
,,will my prescription copays count toward out of pocket max,deductible_oop_inquiry
,,will paying copays help me reach my out of pocket max,deductible_oop_inquiry
,,will the co pay count towards my my out of pocket maximum,deductible_oop_inquiry
,,will the coinsurance amounts count towards my oopm,deductible_oop_inquiry
,,will the plan ever cover MASKING_NUMBER_a percent,deductible_oop_inquiry
,,will the plan ever pay for everything,deductible_oop_inquiry
,,if i have coinsurance do i still have a out of pocket maximum i need to meet,deductible_oop_inquiry
,,if ive already hit my out of pocket maximum does it matter if i go to an out of network provider,deductible_oop_inquiry
,,what is my MASKING_PROVIDER_SPECIALTY_1 deductable,deductible_oop_inquiry
,,are my MASKING_PROCEDURE_NAME_1 subject to a deductible,deductible_oop_inquiry
,,can you tell me if there is a different deductible for prescription MASKING_PROVIDER_SPECIALTY_1,deductible_oop_inquiry
,,do costs for perscriptions go toward my deductible,deductible_oop_inquiry
,,do i have a prescription deductible soemtimes pills are cheaper through insurance even tho we have not met deductible,deductible_oop_inquiry
,,do i have a rx deductible,deductible_oop_inquiry
,,do i have to meet the deductible when i buy a drug,deductible_oop_inquiry
,,do my prescription medications go towards the deductible,deductible_oop_inquiry
,,do MASKING_PROVIDER_SPECIALTY_1 expenses have their own deductible,deductible_oop_inquiry
,,do scripts have a deductible,deductible_oop_inquiry
,,do you know how much my deductible is for an rx,deductible_oop_inquiry
,,do you know if i will have to pay on a different dedcutible for my MASKING_PROVIDER_SPECIALTY_1 i need to find out thanks,deductible_oop_inquiry
,,does a MASKING_PROVIDER_SPECIALTY_1 script apply towards the deductible,deductible_oop_inquiry
,,does the dedictbile include my costs for prescription MASKING_PROVIDER_SPECIALTY_1,deductible_oop_inquiry
,,does the deductible apply to MASKING_PROCEDURE_NAME_1,deductible_oop_inquiry
,,does the entire cost of the MASKING_PROVIDER_SPECIALTY_1 go toward the deductible until it is met,deductible_oop_inquiry
,,hi i am trying to figure out which MASKING_PROCEDURE_NAME_1 count for the deductible,deductible_oop_inquiry
,,how much is my deductible for medication,deductible_oop_inquiry
,,how much is MASKING_MEDICATION_1 deductible,deductible_oop_inquiry
,,i am wondering if pharamcy scripts count towards my deductible,deductible_oop_inquiry
,,i think my deductible is MASKING_NUMBER_a MASKING_NUMBER_b so my prescription cost goes against this is that correct,deductible_oop_inquiry
,,if i need an rx is there a different dedcutible for those do you know,deductible_oop_inquiry
,,is there a MASKING_PROVIDER_SPECIALTY_1 deductible,deductible_oop_inquiry
,,is there a prescription medication deductible,deductible_oop_inquiry
,,is there a separate deductible for rxs,deductible_oop_inquiry
,,is there another deductible for the MASKING_PROVIDER_SPECIALTY_1,deductible_oop_inquiry
,,is there any kind of different dollar amount that i have to pay before i get MASKING_PROCEDURE_NAME_1,deductible_oop_inquiry
,,once my prescription costs meet my deductible of MASKING_NUMBER_a MASKING_NUMBER_b i would not have to pay anything towards my drugs,deductible_oop_inquiry
,,tell me more about MASKING_PROVIDER_SPECIALTY_1 deductible,deductible_oop_inquiry
,,what does it mean that my plan does not have MASKING_PROVIDER_SPECIALTY_1 deductible,deductible_oop_inquiry
,,what is my deductible for an rx,deductible_oop_inquiry
,,what is my deductible for MASKING_PROCEDURE_NAME_1,deductible_oop_inquiry
,,what is my MASKING_PROVIDER_SPECIALTY_1 deductible for my MASKING_PROVIDER_SPECIALTY_2,deductible_oop_inquiry
,,what is the amount for the MASKING_PROVIDER_SPECIALTY_1 deductible,deductible_oop_inquiry
,,what is the prescription deductible,deductible_oop_inquiry
,,is there a lifetime max on medication costs?,deductible_oop_inquiry
,,does optum set a year-over-year maximum on rx services?,deductible_oop_inquiry
,,how much will the play pay per lifetime for MASKING_PROCEDURE_NAME_1?,deductible_oop_inquiry
,,does the lifetime max apply to MASKING_PROCEDURE_NAME_1?,deductible_oop_inquiry
,,lifetime MASKING_PROCEDURE_NAME_1 for MASKING_PROCEDURE_NAME_1,deductible_oop_inquiry
,,do medication copays apply toward yearly out of pocket maximum,deductible_oop_inquiry
,,do rx copays count toward out of pocket limit,deductible_oop_inquiry
,,does my drug coverage have an out of pocket max too,deductible_oop_inquiry
,,does my prescription copay count towards the out of pocket maximum,deductible_oop_inquiry
,,prescription copay count toward annual out of pocket maximum,deductible_oop_inquiry
,,prescription copay counts toward annual limit,deductible_oop_inquiry
,,would my rx costs go towards the year out of pocket max,deductible_oop_inquiry
,,do medication copays apply toward yeearly out of pocket max,deductible_oop_inquiry
