ignore_masked,example,example_masked,intent
,,How many PT sessions are covered? What is my copay for PT?,benefit_coverage
,,do I have MASKING_PROCEDURE_NAME_1 coverage as a benefit? My MASKING_DEPENDENT_RELATIONSHIP_1 will need this,benefit_coverage
,,can i have a colonoscopy,benefit_coverage
,,can i have a MASKING_PROCEDURE_NAME_1,benefit_coverage
,,can i get a new hip?,benefit_coverage
,,I've just dicovered that I'm pregnant and want to see what maternity care is available to me on my current plan.,benefit_coverage
,,I've just dicovered that I'm pregnant and want to see what MASKING_PROVIDER_SPECIALTY_1 is available to me on my current plan.,benefit_coverage
,,Are the MASKING_PROCEDURE_NAME_1 for MASKING_MEDICAL_CONDITION_1 covered? How much do I have to pay to get a new one? The one I have is old so I should probably replace it,benefit_coverage
,,Does my insurance cover an MRI?,benefit_coverage
,,Does my insurance cover an MASKING_PROCEDURE_NAME_1?,benefit_coverage
,,Can I get my cholesterol levels checked?,benefit_coverage
,,i need me some to get some prenatal care,benefit_coverage
,,I think I need to have a knee replacement done this year. Can you tell me how that will affect my coverage?,benefit_coverage
,,"Is MASKING_PROCEDURE_NAME_1 covered under the plan, and do I have use a specific facility?",benefit_coverage
,,do I have prenatal care coverage as a benefit? My wife will need this,benefit_coverage
,,does my dependents cover routine health check,benefit_coverage
,,I'm pregnant right now and my doctor suggested I schedule a nuchal translucency scan. Is that covered by my health insurance? How much is that going to cost? And where should I get this done?,benefit_coverage
,,How much is the average liver functionality test? Does insurance cover that?,benefit_coverage
,,Do I have to pay for a breast pump or will my insurance cover that cost?,benefit_coverage
,,Does my insurance cover nuchal translucency scans? Also does it cover breast pumps? How much will I have to pay for both?,benefit_coverage
,,Do I have to pay for a MASKING_PROCEDURE_NAME_1 or will my insurance cover that cost?,benefit_coverage
,,What is my out of pocket responsibility for an MASKING_PROCEDURE_NAME_1?,benefit_coverage
,,Do I have coverage for MASKING_PROCEDURE_NAME_1?,benefit_coverage
,,Can you please tell me about benefits relating to orthopedic surgery?,benefit_coverage
,,Can you please tell me about benefits relating to MASKING_PROVIDER_SPECIALTY_1?,benefit_coverage
,,What will be my out of pocket cost for the visit?,benefit_coverage
,,Are the pumps for diabetes covered? How much do I have to pay to get a new one? The one I have is old so I should probably replace it,benefit_coverage
,,Are there benefit limitations under my plan for MASKING_PROCEDURE_NAME_1?,benefit_coverage
,,Will this lab test be covered 100% as preventive care?,benefit_coverage
,,Have I reached my annual deductible yet?,deductible_oop_inquiry
,,What are my deductibles?,deductible_oop_inquiry
,,Have I met my deductible?,deductible_oop_inquiry
,,"I have a high deductible MASKING_PROCEDURE_NAME_1 policy with HSA, how much is the MASKING_DEPENDENT_RELATIONSHIP_1 deductible for this year?",deductible_oop_inquiry
,,How much did I pay out-of-pocket in MASKING_NUMBER_a?,deductible_oop_inquiry
,,how much is remaining in my deductible?,deductible_oop_inquiry
,,Is there an individual deductible maximum within our family deductible amount?,deductible_oop_inquiry
,,"I have a high deductible health insurance policy with HSA, how much is the family deductible for this year?",deductible_oop_inquiry
,,What's the out of pocket maximum on my personal insurance plan?,deductible_oop_inquiry
,,How much is my deductible?,deductible_oop_inquiry
,,Where am I on hitting my deductible?,deductible_oop_inquiry
,,What is my MASKING_DEPENDENT_RELATIONSHIP_1 deductible?,deductible_oop_inquiry
,,How much of my annual deductible have I met?,deductible_oop_inquiry
,,What is my family deductible?,deductible_oop_inquiry
,,How close am I to hitting my deductible? ,deductible_oop_inquiry
,,"Currently, how much of my deductible and my family deductible threshold amounts are satisfied for this year?",deductible_oop_inquiry
,,How much do I have left until I hit my deductible? ,deductible_oop_inquiry
,,what is my out-of-pocket-maximum for this year?,deductible_oop_inquiry
,,I want to know if I have met my deductible yet this year.,deductible_oop_inquiry
,,How much is left on my deductible?,deductible_oop_inquiry
,,how much of my deductible is remaining?,deductible_oop_inquiry
,,Will the cost of this service exhaust my deductible?,deductible_oop_inquiry
,,What is my deductible?,deductible_oop_inquiry
,,How much did I pay out-of-pocket in 2017?,deductible_oop_inquiry
,,does the co-pay for office visit count towards my deductible?,deductible_oop_inquiry
,,does the co-pay for MASKING_PROCEDURE_NAME_1 count towards my deductible?,deductible_oop_inquiry
,,Hi! I wanted to know how much is my deductible?,deductible_oop_inquiry
,,How much more do I have to spend to meet the deductible of my high-deductible plan?,deductible_oop_inquiry
,,Has my child met his individual annual deductible?,deductible_oop_inquiry
,,How close to my deductible am I?,deductible_oop_inquiry
,,What is my deductible for in-network?,deductible_oop_inquiry
,,"What happens when I exceed my ""Annual Deductible""?",deductible_oop_inquiry
,,Where am I relative to my out of pocket max?,deductible_oop_inquiry
,,What is my out of pocket maximum?,deductible_oop_inquiry
,,Is there an individual deductible maximum within our MASKING_DEPENDENT_RELATIONSHIP_1 deductible amount?,deductible_oop_inquiry
,,How much of my deductible do I have left?,deductible_oop_inquiry
,,Can you tell me if my deductible has been met on my insurance ?,deductible_oop_inquiry
,,What is my coinsurance out of pocket maximum?,deductible_oop_inquiry
,,how do i know if i met my detectible ,deductible_oop_inquiry
,,"Currently, how much of my deductible and my MASKING_DEPENDENT_RELATIONSHIP_1 deductible threshold amounts are satisfied for this year?",deductible_oop_inquiry
,,MASKING_PERSON_NAME_1 the cost of this service MASKING_MEDICAL_CONDITION_1 my deductible?,deductible_oop_inquiry
,,How much is my out of pocket maximum?,deductible_oop_inquiry
,,MASKING_PROCEDURE_NAME_1 met his individual annual deductible?,deductible_oop_inquiry
,,I can not choose now,dont_know_yet_maybe
,,I haven't decided yet,dont_know_yet_maybe
,,Both options seems relevant,dont_know_yet_maybe
,,unknown,dont_know_yet_maybe
,,I don't know,dont_know_yet_maybe
,,I'm not sure what option to take,dont_know_yet_maybe
,,no idea,dont_know_yet_maybe
,,Maybe I will choose X option,dont_know_yet_maybe
,,"i can, just one sec",exclaimation_positive
,,thank you,exclaimation_positive
,,Cool,exclaimation_positive
,,Super,exclaimation_positive
,,terrific,exclaimation_positive
,,cool beans,exclaimation_positive
,,amazing!,exclaimation_positive
,,i love this,exclaimation_positive
,,"good, thanks",exclaimation_positive
,,adorable,exclaimation_positive
,,alright,exclaimation_positive
,,"thanks, good",exclaimation_positive
,,wonderful,exclaimation_positive
,,that would be great,exclaimation_positive
,,this is awesome,exclaimation_positive
,,excellent,exclaimation_positive
,,thx,exclaimation_positive
,,Awesome,exclaimation_positive
,,incredible,exclaimation_positive
,,thats cute,exclaimation_positive
,,shit,exclamation_negative
,,ugh. annoyed,exclamation_negative
,,I dont think so,exclamation_negative
,,wrong answer,exclamation_negative
,,that did not work,exclamation_negative
,,absolutely not,exclamation_negative
,,that sucks,exclamation_negative
,,you are not right,exclamation_negative
,,there is an error,exclamation_negative
,,you are wrong,exclamation_negative
,,it didnt work,exclamation_negative
,,ive been better,feelings_bad
,,not good,feelings_bad
,,terrible,feelings_bad
,,really bad,feelings_bad
,,ive had better days,feelings_bad
,,not too goo,feelings_bad
,,the worst!,feelings_bad
,,not well,feelings_bad
,,not great,feelings_bad
,,horrible!,feelings_bad
,,not okay,feelings_bad
,,not the best,feelings_bad
,,this is frustrating,feelings_bad
,,not too good...,feelings_bad
,,this is the worst,feelings_bad
,,awful,feelings_bad
,,not too great,feelings_bad
,,that's dissapointing,feelings_bad
,,im unhappy,feelings_bad
,,i hate you,feelings_bad
,,poor,feelings_bad
,,this is awful,feelings_bad
,,bad,feelings_bad
,,not doing good,feelings_bad
,,not doing well,feelings_bad
,,this sucks,feelings_bad
,,sucks,feelings_bad
,,im sad,feelings_bad
,,crappy,feelings_bad
,,im quite dissapointed,feelings_bad
,,shitty,feelings_bad
,,very disapointing to hear that,feelings_bad
,,i am not happy,feelings_bad
,,not so good,feelings_bad
,,unwell,feelings_bad
,,well,feelings_good
,,cooooooooooooool,feelings_good
,,good goo,feelings_good
,,not too bad,feelings_good
,,im happy,feelings_good
,,not bad,feelings_good
,,pretty good,feelings_good
,,pretty great,feelings_good
,,goo,feelings_good
,,great,feelings_good
,,pretty well,feelings_good
,,I'm doing well,feelings_good
,,goo u,feelings_good
,,really good,feelings_good
,,no complaints,feelings_good
,,can't complain,feelings_good
,,good,feelings_good
,,I need to go to ER what is my coverage,medical_emergency
,,I need to go to MASKING_PROCEDURE_NAME_1 what is my coverage,medical_emergency
,,I'm having severe pain in the belly. Can I go to ER?,medical_emergency
,,Do I have to MASKING_PROCEDURE_NAME_4 you before going to MASKING_PROCEDURE_NAME_1?,medical_emergency
,,Do I have to inform you before going to emergency care?,medical_emergency
,,I'm having MASKING_PROCEDURE_NAME_1. Can I go to MASKING_PROCEDURE_NAME_2?,medical_emergency
,,do i need to get approval for an emergency?,medical_emergency
,,how does it work with medical emergency,medical_emergency
,,should I let you know when I have a medical emergency?,medical_emergency
,,do i need to get approval for an MASKING_PROCEDURE_NAME_1?,medical_emergency
,,I have an emergency...,medical_emergency
,,Do I need to call the insurance department if I am having a medical emergency?,medical_emergency
,,"Help, I'm out of town and am injured. Who should I see?",medical_emergency
,,I have an MASKING_PROCEDURE_NAME_1...,medical_emergency
,,"sorry, no",no
,,nothing,no
,,no,no
,,don't want,no
,,"No, that's it",no
,,n,no
,,no thanks,no
,,not,no
,,nop,no
,,y,yes
,,okay,yes
,,ok,yes
,,k,yes
,,sure,yes
,,yup,yes
,,yes,yes
,,yep,yes
,,is there a separate deductible for mental health benefits,deductible_oop_inquiry
,,mental health deductible,deductible_oop_inquiry
,,deductible for MASKING_PROCEDURE_NAME_1,deductible_oop_inquiry
,,do MASKING_PROVIDER_SPECIALTY_1 services apply toward the regular deductible,deductible_oop_inquiry
,,what is the deductible for mental health,deductible_oop_inquiry
,,Is there a lifetime MASKING_PROCEDURE_NAME_1 on MASKING_PROCEDURE_NAME_1,deductible_oop_inquiry
,,MASKING_PROVIDER_SPECIALTY_1 lifetime limit,deductible_oop_inquiry
,,Is there a year-over-year limit on MASKING_PROVIDER_SPECIALTY_1 expenses?,deductible_oop_inquiry
,,Lifetime max for mental health,deductible_oop_inquiry
,,MASKING_PROCEDURE_NAME_1 life time maximum,deductible_oop_inquiry
,,What is the out of pocket maximum for MASKING_PROCEDURE_NAME_1?,deductible_oop_inquiry
,,What's the most I could possibly pay if I have to send my MASKING_DEPENDENT_RELATIONSHIP_1 to MASKING_PROVIDER_SPECIALTY_1,deductible_oop_inquiry
,,Do MASKING_PROCEDURE_NAME_1 apply to the out of pocket max?,deductible_oop_inquiry
,,Is there a separate annual limit for mental health benefits?,deductible_oop_inquiry
,,Maximum yearly amount for MASKING_PROCEDURE_NAME_1,deductible_oop_inquiry
,,after meeting deductable,deductible_oop_inquiry
,,am i close to meeting my deductible,deductible_oop_inquiry
,,calendar year or plan year deductible accumulation,deductible_oop_inquiry
,,can i get the cost that has to be paid before i do anything can you help with that thanks,deductible_oop_inquiry
,,can i meet my deductible with copays,deductible_oop_inquiry
,,can i satisfy the whole MASKING_DEPENDENT_RELATIONSHIP_1 deductible myself,deductible_oop_inquiry
,,can the full MASKING_NUMBER_a deductible be met by one participant in the plan,deductible_oop_inquiry
,,can what i spend on copays count toward meeting my deductible,deductible_oop_inquiry
,,can you see how much i have paid towards my deductable,deductible_oop_inquiry
,,can you tell me what my deductible is,deductible_oop_inquiry
,,carryover of deductible,deductible_oop_inquiry
,,cost to meet in network deductible,deductible_oop_inquiry
,,cost to meet out of network deductible,deductible_oop_inquiry
,,deductible amount,deductible_oop_inquiry
,,deductible based on calendar year or plan year,deductible_oop_inquiry
,,deductible limit,deductible_oop_inquiry
,,deductible totals,deductible_oop_inquiry
,,do i have a deductible,deductible_oop_inquiry
,,do i have to pay for claims before the plan starts to pay,deductible_oop_inquiry
,,do i need to meet my deductible for MASKING_PROVIDER_SPECIALTY_1,deductible_oop_inquiry
,,do i need to meet my deductible for preventive MASKING_PROCEDURE_NAME_1,deductible_oop_inquiry
,,do i pay MASKING_NUMBER_a percent until i meet the individual deductable,deductible_oop_inquiry
,,do you know if i have a deductible that i need to pay thanks,deductible_oop_inquiry
,,do you know if i have met my deductible yet,deductible_oop_inquiry
,,does deductible carryover,deductible_oop_inquiry
,,does my copay accumulate toward my deductible,deductible_oop_inquiry
,,does my copay count toward my deductible,deductible_oop_inquiry
,,does my deductible accumulate during my calendar year or plan year,deductible_oop_inquiry
,,does my deductible need to be met before my plan will pay on claims,deductible_oop_inquiry
,,does my plan have an in network deductible,deductible_oop_inquiry
,,does my plan have an overall in network deductible,deductible_oop_inquiry
,,does paying copays help me reach my overall in network deductible,deductible_oop_inquiry
,,does the deductible apply for MASKING_PROVIDER_SPECIALTY_1,deductible_oop_inquiry
,,MASKING_DEPENDENT_RELATIONSHIP_1 deductable,deductible_oop_inquiry
,,has my deductible been met,deductible_oop_inquiry
,,have i met m y deductible,deductible_oop_inquiry
,,have i met my deductible,deductible_oop_inquiry
,,have i reached my deductubles,deductible_oop_inquiry
,,have i used my deductible,deductible_oop_inquiry
,,hello what is my deductible,deductible_oop_inquiry
,,hi can you tell me how does a deductible work i need to find out thanks,deductible_oop_inquiry
,,hi can you tell me if i have met my deductible thanks,deductible_oop_inquiry
,,hi i thought that i had already met my deductible so why did i get a bill,deductible_oop_inquiry
,,how do i find out if i have met my deductable,deductible_oop_inquiry
,,how do i meet my deductible,deductible_oop_inquiry
,,how do i meet my overall in network deductible,deductible_oop_inquiry
,,how do i meet my overall out of network deductible,deductible_oop_inquiry
,,how does it work with with my deductible,deductible_oop_inquiry
,,how does my deductible work,deductible_oop_inquiry
,,how does the deductible work,deductible_oop_inquiry
,,how much do i have left on my deductible,deductible_oop_inquiry
,,how much do i have to pay before medical insurance will cover my expenses,deductible_oop_inquiry
,,how much do i have to pay before the plan begins to pay,deductible_oop_inquiry
,,how much do i have to pay before the plan pays,deductible_oop_inquiry
,,how much do i have to spend before i meet my deductible,deductible_oop_inquiry
,,how much do i need to spend before meeting my in network deductible,deductible_oop_inquiry
,,how much have i paid towards my deductible so far,deductible_oop_inquiry
,,how much have i paid towards my deductiblee,deductible_oop_inquiry
,,how much is left in my deductible,deductible_oop_inquiry
,,how much is left on my deductible,deductible_oop_inquiry
,,how much is the deductable,deductible_oop_inquiry
,,how much is my deductible,deductible_oop_inquiry
,,how much is my non network deductible,deductible_oop_inquiry
,,how much of my deductible has been met,deductible_oop_inquiry
,,how much of my deductible i have spent already,deductible_oop_inquiry
,,i know that i have that amount i have to pay toward medical first can you tell me how much is left to pay,deductible_oop_inquiry
,,i know there is an amount that i have to pay first can you tell me more about that,deductible_oop_inquiry
,,i need to find out what my deductible MASKING_PROCEDURE_NAME_1 is do you know,deductible_oop_inquiry
,,if i am paying for MASKING_PROCEDURE_NAME_1 outside of the network is there ways i can save money or it go to my deductible,deductible_oop_inquiry
,,if i have covered MASKING_DEPENDENT_RELATIONSHIP_1 under an hsa eligible plan option how do the deductibles work,deductible_oop_inquiry
,,in network deductible,deductible_oop_inquiry
,,is a deductible on a per MASKING_PROVIDER_SPECIALTY_1 basis or once you hit the MASKING_NUMBER_a deductible you no longer pay,deductible_oop_inquiry
,,is the deductible based on the calendar year or plan year,deductible_oop_inquiry
,,is there a dollar amount that has to be paid before i go to a MASKING_PROFESSIONAL_GROUP_1,deductible_oop_inquiry
,,is there a limit per participant on reaching the maximum MASKING_DEPENDENT_RELATIONSHIP_1 deductible,deductible_oop_inquiry
,,is there a MASKING_PROVIDER_SPECIALTY_1 deductible,deductible_oop_inquiry
,,is there a preventive MASKING_PROCEDURE_NAME_1 care deductible,deductible_oop_inquiry
,,is there an amount of charges i have to pay before the plan starts to pay,deductible_oop_inquiry
,,is there a deductible on my plan,deductible_oop_inquiry
,,must individual meet the MASKING_DEPENDENT_RELATIONSHIP_1 deductible,deductible_oop_inquiry
,,my deductible is how much,deductible_oop_inquiry
,,my insurance year is MASKING_PERSON_NAME_1 will costs in may and june count towards this years deductible,deductible_oop_inquiry
,,non network deductible,deductible_oop_inquiry
,,on my plan what is the deductable amount,deductible_oop_inquiry
,,out of network deductible,deductible_oop_inquiry
,,tracking my deductable,deductible_oop_inquiry
,,uhc only paid a part of my MASKING_PROCEDURE_NAME_1 even though i met my deductible,deductible_oop_inquiry
,,ways to meet my deductible,deductible_oop_inquiry
,,wha tis my deductible,deductible_oop_inquiry
,,what are my current deductibles,deductible_oop_inquiry
,,what are my deductibles,deductible_oop_inquiry
,,what are my in network limits,deductible_oop_inquiry
,,what are the deductibles,deductible_oop_inquiry
,,what counts toward meeting my deductible,deductible_oop_inquiry
,,what deductible amount do i have to meet,deductible_oop_inquiry
,,what does insurance cover once i meet my deductible,deductible_oop_inquiry
,,what goes against the deducatble,deductible_oop_inquiry
,,what happens after deductible has been met,deductible_oop_inquiry
,,what helps me meet my deductible,deductible_oop_inquiry
,,what is my annual deductible,deductible_oop_inquiry
,,what is my current deductible amount,deductible_oop_inquiry
,,what is my ded,deductible_oop_inquiry
,,what is my deductable,deductible_oop_inquiry
,,what is my deductibe,deductible_oop_inquiry
,,what is my deductible,deductible_oop_inquiry
,,what is my MASKING_DEPENDENT_RELATIONSHIP_1 deductible,deductible_oop_inquiry
,,what is my health deductible,deductible_oop_inquiry
,,what is my individual ded,deductible_oop_inquiry
,,what is my individual deductible,deductible_oop_inquiry
,,what is my medical deductable,deductible_oop_inquiry
,,what is my overall deductible,deductible_oop_inquiry
,,what is my overall non network deductible,deductible_oop_inquiry
,,what is my plan deductible,deductible_oop_inquiry
,,what is my plans individual deductible,deductible_oop_inquiry
,,what is my preventive deductible,deductible_oop_inquiry
,,what is my preventive MASKING_PROCEDURE_NAME_1 deductible,deductible_oop_inquiry
,,what is my total deductable,deductible_oop_inquiry
,,what is the amount for meeting my deductible,deductible_oop_inquiry
,,what is the amount i need to meet before coverage applies,deductible_oop_inquiry
,,what is the amount of money i need to meet each year before things are covered,deductible_oop_inquiry
,,what is the deductible,deductible_oop_inquiry
,,what is the deductible on my plan,deductible_oop_inquiry
,,what is the deductible this year,deductible_oop_inquiry
,,what is the in network deductible,deductible_oop_inquiry
,,what is the maximum out of pocket deductable,deductible_oop_inquiry
,,what is the out of network deductible amount,deductible_oop_inquiry
,,what is the overall deductible,deductible_oop_inquiry
,,what will i pay after meeting MASKING_DEPENDENT_RELATIONSHIP_1 deductable,deductible_oop_inquiry
,,when does my deductible reset,deductible_oop_inquiry
,,where am i with my deductible,deductible_oop_inquiry
,,why am i getting bills if i met my deductible,deductible_oop_inquiry
,,why did my plan not pay for everything after i met my deductible,deductible_oop_inquiry
,,why do i still get a bill after meeting my deductible,deductible_oop_inquiry
,,why does insurance only cover part of MASKING_PROCEDURE_NAME_1 even after i meet my deductible,deductible_oop_inquiry
,,why does MASKING_PERSON_NAME_1 only pay for a portion of my procedure costs,deductible_oop_inquiry
,,will paying copays help me reach my deductible,deductible_oop_inquiry
,,with family coverage does each participant have to contribute a portion towards deductible,deductible_oop_inquiry
,,yes can you tell me if i have a deductible or not,deductible_oop_inquiry
,,how much is my deductible,deductible_oop_inquiry
,,What out of pocket expenses are put toward my deductible,deductible_oop_inquiry
,,are there MASKING_MEDICAL_CONDITION_1 specific deductibles,deductible_oop_inquiry
,,are there other deductibles for special services,deductible_oop_inquiry
,,are there special service deductibles,deductible_oop_inquiry
,,do i have to meet a MASKING_MEDICAL_CONDITION_1 specific deductible,deductible_oop_inquiry
,,do i have to meet a special service deductible,deductible_oop_inquiry
,,does my plan have a MASKING_MEDICAL_CONDITION_1 specific deductible,deductible_oop_inquiry
,,how much is my MASKING_MEDICAL_CONDITION_1 specific deductible,deductible_oop_inquiry
,,how much is my special services deductible,deductible_oop_inquiry
,,what is my MASKING_MEDICAL_CONDITION_1 specific deductible,deductible_oop_inquiry
,,what is my special services deductible,deductible_oop_inquiry
,,do i have a lifetime maximum,deductible_oop_inquiry
,,how do i know when ive met my lifetime maximum,deductible_oop_inquiry
,,is there a lifetime limit on any services covered on this plan,deductible_oop_inquiry
,,is there a lifetime maximum plan benefit,deductible_oop_inquiry
,,is there a lifetime plan maximum,deductible_oop_inquiry
,,is there a monetary limit for covered services,deductible_oop_inquiry
,,is there an annual limit on any services covered on this plan,deductible_oop_inquiry
,,lifetime limit for covered MASKING_PROCEDURE_NAME_1,deductible_oop_inquiry
,,lifetime maximum what is it,deductible_oop_inquiry
,,lifetime plan maximum,deductible_oop_inquiry
,,plan lifetime maximum,deductible_oop_inquiry
,,what is my lifetime maximum,deductible_oop_inquiry
,,what is my lifetime maximum on my plan,deductible_oop_inquiry
,,amount of my in network out of pocket maximum,deductible_oop_inquiry
,,amount of my non network out of pocket maximum,deductible_oop_inquiry
,,amount of my out of network out of pocket maximum,deductible_oop_inquiry
,,annual limit for the consumer choice plan,deductible_oop_inquiry
,,are copays included in out of pocket max,deductible_oop_inquiry
,,at what point does the plan pay MASKING_NUMBER_a percent,deductible_oop_inquiry
,,can what i spend on copays count toward meeting my oopm,deductible_oop_inquiry
,,can what i spend on copays count toward meeting my yearly max,deductible_oop_inquiry
,,can what i spend on copays count toward my out of pocket maximum,deductible_oop_inquiry
,,can you confirm what the max out of pocket cost for my plan is,deductible_oop_inquiry
,,can you tell me how much my non network out of pocket maximum is,deductible_oop_inquiry
,,comparison of in network vs out of network for out of pocket max,deductible_oop_inquiry
,,copay count toward out of pocket maximum,deductible_oop_inquiry
,,definition of out of pocket maximum,deductible_oop_inquiry
,,do co insurance MASKING_PROCEDURE_NAME_1 accumulate towards anything,deductible_oop_inquiry
,,do i get money spent over my out of pocket maximum refunded to me,deductible_oop_inquiry
,,do in network charges still count towards my oopm,deductible_oop_inquiry
,,do my copays count towards the plan out of pocket maximum,deductible_oop_inquiry
,,do you know my in network out of pocket max,deductible_oop_inquiry
,,do you know what my in network out of pocket max is,deductible_oop_inquiry
,,does my coinsurance count toward my out of pocket maximum,deductible_oop_inquiry
,,does my copay accumulate to meeting my oopm,deductible_oop_inquiry
,,does my copay accumulate to meeting my out of pocket maximum oopm,deductible_oop_inquiry
,,does my copay count toward my oopm,deductible_oop_inquiry
,,does my MASKING_DEPENDENT_RELATIONSHIP_1 have to meet the out of pocket maximum if i have met mine to be covered,deductible_oop_inquiry
,,does my MASKING_PROVIDER_SPECIALTY_1 copay count towards the plan max,deductible_oop_inquiry
,,does my plan have an out of pocket maximum,deductible_oop_inquiry
,,does the MASKING_DEPENDENT_RELATIONSHIP_1 out of pocket maximum have to be reached before individual is covered,deductible_oop_inquiry
,,does the plan every pay MASKING_NUMBER_a percent,deductible_oop_inquiry
,,have i met my out of pocket,deductible_oop_inquiry
,,how do i check my out of pocket blanace,deductible_oop_inquiry
